{"generated_at":"2025-11-11T06:00:00Z","fixture":true,"horizons_h":[24,48,72],"wards":[{"ward_id":"delhi_273","name":"DELHI CANTT CHARGE 1","series":[{"h":24,"pm25_p50":221.9,"pm25_p90":353.1,"subindex24h":387.0,"category":"Very Poor","confidence":"high"},{"h":48,"pm25_p50":219.2,"pm25_p90":353.5,"subindex24h":385.0,"category":"Very Poor","confidence":"med"},{"h":72,"pm25_p50":219.9,"pm25_p90":362.3,"subindex24h":386.0,"category":"Very Poor","confidence":"low"}]},{"ward_id":"delhi_274","name":"DELHI CANTT CHARGE 2","series":[{"h":24,"pm25_p50":217.6,"pm25_p90":345.8,"subindex24h":384.0,"category":"Very Poor","confidence":"high"},{"h":48,"pm25_p50":233.7,"pm25_p90":391.8,"subindex24h":397.0,"category":"Very Poor","confidence":"med"},{"h":72,"pm25_p50":199.1,"pm25_p90":316.4,"subindex24h":369.0,"category":"Very Poor","confidence":"low"}]},{"ward_id":"delhi_276","name":"DELHI CANTT CHARGE 4","series":[{"h":24,"pm25_p50":165.1,"pm25_p90":243.5,"subindex24h":342.0,"category":"Very Poor","confidence":"high"},{"h":48,"pm25_p50":184.9,"pm25_p90":293.6,"subindex24h":358.0,"category":"Very Poor","confidence":"med"},{"h":72,"pm25_p50":201.7,"pm25_p90":340.1,"subindex24h":371.0,"category":"Very Poor","confidence":"low"}]},{"ward_id":"delhi_277","name":"DELHI CANTT CHARGE 5","series":[{"h":24,"pm25_p50":201.9,"pm25_p90":325.8,"subindex24h":371.0,"category":"Very Poor","confidence":"high"},{"h":48,"pm25_p50":171.5,"pm25_p90":261.3,"subindex24h":347.0,"category":"Very Poor","confidence":"med"},{"h":72,"pm25_p50":203.1,"pm25_p90":341.1,"subindex24h":372.0,"category":"Very Poor","confidence":"low"}]},{"ward_id":"delhi_278","name":"DELHI CANTT CHARGE 6","series":[{"h":24,"pm25_p50":160.6,"pm25_p90":234.8,"subindex24h":338.0,"category":"Very Poor","confidence":"high"},{"h":48,"pm25_p50":189.2,"pm25_p90":305.0,"subindex24h":361.0,"category":"Very Poor","confidence":"med"},{"h":72,"pm25_p50":215.7,"pm25_p90":377.0,"subindex24h":382.0,"category":"Very Poor","confidence":"low"}]},{"ward_id":"delhi_279","name":"DELHI CANTT CHARGE 7","series":[{"h":24,"pm25_p50":205.8,"pm25_p90":324.8,"subindex24h":374.0,"category":"Very Poor","confidence":"high"},{"h":48,"pm25_p50":229.8,"pm25_p90":390.1,"subindex24h":394.0,"category":"Very Poor","confidence":"med"},{"h":72,"pm25_p50":242.5,"pm25_p90":429.9,"subindex24h":405.0,"category":"Severe","confidence":"low"}]},{"ward_id":"delhi_280","name":"DELHI CANTT CHARGE 8","series":[{"h":24,"pm25_p50":192.3,"pm25_p90":292.2,"subindex24h":363.0,"category":"Very Poor","confidence":"high"},{"h":48,"pm25_p50":234.6,"pm25_p90":400.5,"subindex24h":398.0,"category":"Very Poor","confidence":"med"},{"h":72,"pm25_p50":228.1,"pm25_p90":390.8,"subindex24h":392.0,"category":"Very Poor","confidence":"low"}]},{"ward_id":"delhi_275","name":"DELHI CANTT CHARGE 3","series":[{"h":24,"pm25_p50":201.3,"pm25_p90":314.4,"subindex24h":371.0,"category":"Very Poor","confidence":"high"},{"h":48,"pm25_p50":228.8,"pm25_p90":387.7,"subindex24h":393.0,"category":"Very Poor","confidence":"med"},{"h":72,"pm25_p50":196.6,"pm25_p90":316.5,"subindex24h":367.0,"category":"Very Poor","confidence":"low"}]},{"ward_id":"delhi_281","name":"NDMC CHARGE 1","series":[{"h":24,"pm25_p50":261.9,"pm25_p90":434.0,"subindex24h":421.0,"category":"Severe","confidence":"high"},{"h":48,"pm25_p50":248.0,"pm25_p90":407.0,"subindex24h":409.0,"category":"Severe","confidence":"med"},{"h":72,"pm25_p50":233.1,"pm25_p90":379.2,"subindex24h":396.0,"category":"Very Poor","confidence":"low"}]},{"ward_id":"delhi_282","name":"NDMC CHARGE 2","series":[{"h":24,"pm25_p50":232.0,"pm25_p90":364.7,"subindex24h":396.0,"category":"Very Poor","confidence":"high"},{"h":48,"pm25_p50":213.3,"pm25_p90":329.0,"subindex24h":380.0,"category":"Very Poor","confidence":"med"},{"h":72,"pm25_p50":218.1,"pm25_p90":347.4,"subindex24h":384.0,"category":"Very Poor","confidence":"low"}]},{"ward_id":"delhi_283","name":"NDMC CHARGE 3","series":[{"h":24,"pm25_p50":238.0,"pm25_p90":390.2,"subindex24h":401.0,"category":"Severe","confidence":"high"},{"h":48,"pm25_p50":238.2,"pm25_p90":397.4,"subindex24h":402.0,"category":"Severe","confidence":"med"},{"h":72,"pm25_p50":215.2,"pm25_p90":349.3,"subindex24h":382.0,"category":"Very Poor","confidence":"low"}]},{"ward_id":"delhi_284","name":"NDMC CHARGE 4","series":[{"h":24,"pm25_p50":220.3,"pm25_p90":341.8,"subindex24h":386.0,"category":"Very Poor","confidence":"high"},{"h":48,"pm25_p50":258.5,"pm25_p90":442.1,"subindex24h":418.0,"category":"Severe","confidence":"med"},{"h":72,"pm25_p50":219.5,"pm25_p90":354.3,"subindex24h":385.0,"category":"Very Poor","confidence":"low"}]},{"ward_id":"delhi_285","name":"NDMC CHARGE 5","series":[{"h":24,"pm25_p50":195.3,"pm25_p90":287.4,"subindex24h":366.0,"category":"Very Poor","confidence":"high"},{"h":48,"pm25_p50":246.7,"pm25_p90":414.3,"subindex24h":408.0,"category":"Severe","confidence":"med"},{"h":72,"pm25_p50":262.5,"pm25_p90":462.2,"subindex24h":421.0,"category":"Severe","confidence":"low"}]},{"ward_id":"delhi_287","name":"NDMC CHARGE 7","series":[{"h":24,"pm25_p50":192.5,"pm25_p90":288.7,"subindex24h":364.0,"category":"Very Poor","confidence":"high"},{"h":48,"pm25_p50":233.9,"pm25_p90":393.0,"subindex24h":397.0,"category":"Very Poor","confidence":"med"},{"h":72,"pm25_p50":206.6,"pm25_p90":334.1,"subindex24h":375.0,"category":"Very Poor","confidence":"low"}]},{"ward_id":"delhi_288","name":"NDMC CHARGE 8","series":[{"h":24,"pm25_p50":178.6,"pm25_p90":260.9,"subindex24h":352.0,"category":"Very Poor","confidence":"high"},{"h":48,"pm25_p50":232.8,"pm25_p90":393.9,"subindex24h":396.0,"category":"Very Poor","confidence":"med"},{"h":72,"pm25_p50":209.7,"pm25_p90":344.2,"subindex24h":378.0,"category":"Very Poor","confidence":"low"}]},{"ward_id":"delhi_289","name":"NDMC CHARGE 9","series":[{"h":24,"pm25_p50":229.8,"pm25_p90":378.7,"subindex24h":394.0,"category":"Very Poor","confidence":"high"},{"h":48,"pm25_p50":201.2,"pm25_p90":316.6,"subindex24h":371.0,"category":"Very Poor","confidence":"med"},{"h":72,"pm25_p50":211.2,"pm25_p90":346.9,"subindex24h":379.0,"category":"Very Poor","confidence":"low"}]},{"ward_id":"delhi_286","name":"NDMC CHARGE 6","series":[{"h":24,"pm25_p50":224.2,"pm25_p90":354.5,"subindex24h":389.0,"category":"Very Poor","confidence":"high"},{"h":48,"pm25_p50":239.1,"pm25_p90":397.5,"subindex24h":402.0,"category":"Severe","confidence":"med"},{"h":72,"pm25_p50":261.5,"pm25_p90":462.0,"subindex24h":420.0,"category":"Severe","confidence":"low"}]},{"ward_id":"delhi_252","name":"CHANDNI CHOWK","series":[{"h":24,"pm25_p50":251.2,"pm25_p90":403.1,"subindex24h":412.0,"category":"Severe","confidence":"high"},{"h":48,"pm25_p50":271.5,"pm25_p90":461.0,"subindex24h":428.0,"category":"Severe","confidence":"med"},{"h":72,"pm25_p50":260.1,"pm25_p90":440.4,"subindex24h":419.0,"category":"Severe","confidence":"low"}]},{"ward_id":"delhi_253","name":"MINTO ROAD","series":[{"h":24,"pm25_p50":259.4,"pm25_p90":423.7,"subindex24h":419.0,"category":"Severe","confidence":"high"},{"h":48,"pm25_p50":268.6,"pm25_p90":454.1,"subindex24h":426.0,"category":"Severe","confidence":"med"},{"h":72,"pm25_p50":225.2,"pm25_p90":358.0,"subindex24h":390.0,"category":"Very Poor","confidence":"low"}]},{"ward_id":"delhi_254","name":"KUCHA PANDIT","series":[{"h":24,"pm25_p50":206.3,"pm25_p90":302.4,"subindex24h":375.0,"category":"Very Poor","confidence":"high"},{"h":48,"pm25_p50":250.8,"pm25_p90":411.6,"subindex24h":412.0,"category":"Severe","confidence":"med"},{"h":72,"pm25_p50":282.6,"pm25_p90":500.0,"subindex24h":437.0,"category":"Severe","confidence":"low"}]},{"ward_id":"delhi_255","name":"BAZAR SITARAM","series":[{"h":24,"pm25_p50":268.6,"pm25_p90":445.6,"subindex24h":426.0,"category":"Severe","confidence":"high"},{"h":48,"pm25_p50":232.0,"pm25_p90":364.9,"subindex24h":396.0,"category":"Very Poor","confidence":"med"},{"h":72,"pm25_p50":249.7,"pm25_p90":414.5,"subindex24h":411.0,"category":"Severe","confidence":"low"}]},{"ward_id":"delhi_257","name":"IDGAH ROAD","series":[{"h":24,"pm25_p50":226.2,"pm25_p90":349.1,"subindex24h":391.0,"category":"Very Poor","confidence":"high"},{"h":48,"pm25_p50":265.9,"pm25_p90":452.8,"subindex24h":424.0,"category":"Severe","confidence":"med"},{"h":72,"pm25_p50":219.1,"pm25_p90":347.8,"subindex24h":385.0,"category":"Very Poor","confidence":"low"}]},{"ward_id":"delhi_011","name":"KHYALA","series":[{"h":24,"pm25_p50":263.1,"pm25_p90":434.2,"subindex24h":421.0,"category":"Severe","confidence":"high"},{"h":48,"pm25_p50":252.7,"pm25_p90":415.9,"subindex24h":413.0,"category":"Severe","confidence":"med"},{"h":72,"pm25_p50":225.7,"pm25_p90":360.1,"subindex24h":390.0,"category":"Very Poor","confidence":"low"}]},{"ward_id":"delhi_012","name":"JANAK PURI NORTH","series":[{"h":24,"pm25_p50":241.0,"pm25_p90":395.2,"subindex24h":404.0,"category":"Severe","confidence":"high"},{"h":48,"pm25_p50":249.8,"pm25_p90":424.2,"subindex24h":411.0,"category":"Severe","confidence":"med"},{"h":72,"pm25_p50":224.3,"pm25_p90":368.9,"subindex24h":389.0,"category":"Very Poor","confidence":"low"}]},{"ward_id":"delhi_013","name":"MUKHERJEE NAGAR","series":[{"h":24,"pm25_p50":228.0,"pm25_p90":369.5,"subindex24h":392.0,"category":"Very Poor","confidence":"high"},{"h":48,"pm25_p50":220.5,"pm25_p90":358.0,"subindex24h":386.0,"category":"Very Poor","confidence":"med"},{"h":72,"pm25_p50":254.6,"pm25_p90":451.0,"subindex24h":415.0,"category":"Severe","confidence":"low"}]},{"ward_id":"delhi_021","name":"JANAK PURI WEST","series":[{"h":24,"pm25_p50":185.1,"pm25_p90":271.4,"subindex24h":358.0,"category":"Very Poor","confidence":"high"},{"h":48,"pm25_p50":196.3,"pm25_p90":302.4,"subindex24h":367.0,"category":"Very Poor","confidence":"med"},{"h":72,"pm25_p50":221.9,"pm25_p90":368.9,"subindex24h":387.0,"category":"Very Poor","confidence":"low"}]},{"ward_id":"delhi_022","name":"JANAK PURI SOUTH","series":[{"h":24,"pm25_p50":220.4,"pm25_p90":352.7,"subindex24h":386.0,"category":"Very Poor","confidence":"high"},{"h":48,"pm25_p50":228.8,"pm25_p90":379.8,"subinde